{
  "episodeId": "YYYY-MM-DD-slug",
  "title": "政経ニュースコーナー",
  "date": "YYYY-MM-DD",
  "voicevox": {
    "baseUrl": "http://127.0.0.1:50021",
    "defaultSpeakers": {
      "china_ai": 8,
      "america_ai": 13
    }
  },
  "slides": [
    {
      "slideId": "s001",
      "title": "タイトル",
      "visual": {
        "type": "title",
        "imagePrompt": "",
        "notes": ""
      },
      "lines": [
        {
          "id": "s001-l001",
          "speaker": "china_ai",
          "voicevoxSpeakerId": 8,
          "text": "あずまぐ同志、今日も世界では重要な出来事が重なっています。揉め事だけは計画なしでも増産されますね。",
          "note": "核心を先に述べ、最後に小さなウィットを一つ入れる"
        },
        {
          "id": "s001-l002",
          "speaker": "america_ai",
          "voicevoxSpeakerId": 13,
          "text": "今日は事実と解釈を分けながら見ていきます。市場は混乱にも値札を付けますが、僕たちまで同じ速さで判断する必要はありません。",
          "note": "日本語・ですます調・一人称は僕"
        },
        {
          "id": "s001-l003",
          "speaker": "human_cue",
          "text": "今日の重大ニュースと、視聴者に持ち帰ってほしい問いを一言で紹介する。",
          "note": "VOICEVOXでは読ませない"
        }
      ]
    }
  ]
}
